{
  "$schema": "../schemas/component-contract.schema.json",
  "id": "dropdown",
  "version": "2.0.0",
  "name": "Dropdown",
  "category": "navigation",
  "intent": "ドロップダウンメニュー。キーボードナビゲーション対応。",
  "docPath": "components/dropdown.md",
  "anatomy": [],
  "variants": {
    "basic": {
      "description": "basic",
      "tokenRefs": {},
      "tailwind": "absolute top-full mt-1 w-48 bg-white rounded-lg border border-slate-200 shadow-md z-20 py-1"
    },
    "with-icons": {
      "description": "with-icons",
      "tokenRefs": {},
      "tailwind": "absolute top-full mt-1 w-48 bg-white rounded-lg border border-slate-200 shadow-md z-20 py-1"
    },
    "with-separator": {
      "description": "with-separator",
      "tokenRefs": {},
      "tailwind": "absolute top-full mt-1 w-48 bg-white rounded-lg border border-slate-200 shadow-md z-20 py-1"
    }
  },
  "sizes": {},
  "states": [
    "default"
  ],
  "a11y": {
    "role": "menu",
    "required": [
      "role=\"menuitem\" on items",
      "aria-haspopup on trigger"
    ],
    "keyboard": [],
    "focusRing": "focus-visible:ring-2 focus-visible:ring-primary-500/50"
  },
  "rules": [],
  "htmlSample": "<div class=\"relative inline-block\"><button aria-haspopup=\"menu\" class=\"h-10 px-4 bg-white border border-slate-200 rounded-lg hover:bg-gray-50\">メニュー</button><div role=\"menu\" class=\"absolute top-full mt-1 w-48 bg-white rounded-lg border border-slate-200 shadow-md z-20 py-1\"><a role=\"menuitem\" class=\"flex items-center gap-3 px-4 py-2 text-sm text-body hover:bg-gray-50\">編集</a></div></div>"
}
